{"adjudication":{"closure_prohibited":true,"confidence":0.9794,"determination_basis":"canonical_official_intelligence_plus_component_evidence_and_runtime_context","human_review_required":true,"reason_codes":["PACKAGE_IDENTITY_MATCHED","COMPONENT_VERSION_IN_AFFECTED_RANGE","AFFECTEDNESS_CONFIRMED","RUNTIME_REACHABILITY_UNKNOWN","CONFIGURATION_STATUS_UNKNOWN"],"status":"AFFECTED","supporting_evidence_ids":["AEG-EVD-SBOM-LOG4J-001","AEG-OFFICIAL-B13909218EDC20AA374F","CANONICAL:AEG-CVI-49B4E71EF44A248DB7A08E5D","ASSET:AEG-AST-HOSP-SCHED-001","RUNTIME:AEG-RTC-LOG4SHELL-DEMO-001"],"technical_status":"affected","uncertainty_factors":["Runtime reachability has not been established. This does not negate package affectedness."]},"audit":{"canonical_json_sha256":"08ef1236c4d8c3cd3c2b186c4766f854ad598d9d3681066c870d6663ca100949","deterministic_report_id":true,"input_hashes":{"asset_context":"bc9cb98980010ca2bc1c123e808296a2e17bb34a5735cf42cd07e1efcfc64395","canonical_intelligence":"81d297eedd42d0cd0f89713dc0cad52e27b46833d97368fcada05f80c206cfe1","component_evidence":"21ed78284567bc33bb463fb2525941829b80c7e21144d17677f022d168a3c2de","runtime_context":"6abaebf0b5b581ce41e4bca16cfeb299bae3606f06d293d8e0b0a48c3e9fcb23"}},"conflicts":[],"generated_at":"2026-07-21T20:18:26.665570+00:00","inputs":{"asset_context":{"record_id":"AEG-AST-HOSP-SCHED-001","relative_path":"data/sample_inputs/assets/valid_healthcare_asset.json","sha256":"bc9cb98980010ca2bc1c123e808296a2e17bb34a5735cf42cd07e1efcfc64395"},"canonical_intelligence":{"record_id":"AEG-CVI-49B4E71EF44A248DB7A08E5D","relative_path":"data/processed/canonical_intelligence/log4shell-20260715T140904Z/aeg-cvi-49b4e71ef44a248db7a08e5d.canonical.json","sha256":"81d297eedd42d0cd0f89713dc0cad52e27b46833d97368fcada05f80c206cfe1"},"component_evidence":{"record_id":"AEG-EVD-SBOM-LOG4J-001","relative_path":"data/sample_inputs/evidence/valid_log4j_sbom_evidence.json","sha256":"21ed78284567bc33bb463fb2525941829b80c7e21144d17677f022d168a3c2de"},"runtime_context":{"record_id":"AEG-RTC-LOG4SHELL-DEMO-001","relative_path":"data/sample_inputs/affectedness/valid_log4shell_runtime_context.json","sha256":"6abaebf0b5b581ce41e4bca16cfeb299bae3606f06d293d8e0b0a48c3e9fcb23"}},"policy":{"engine_version":"1.0.0","policy_id":"AEGIS-AFFECTEDNESS-ADJUDICATION-POLICY","sha256":"dd923caee05263776aa23e7171a421d4a66a2df77be252a7350fa4aaec29844f","version":"1.0.0"},"quality_gates":[{"expected":4,"gate_id":"M12C-INPUT-REFERENCES","metric":"required_input_reference_count","observed":4,"pass":true},{"expected":["ACCEPT","ACCEPT_WITH_WARNINGS"],"gate_id":"M12C-CANONICAL-TRUST","metric":"canonical_intelligence_trust_action","observed":"ACCEPT","pass":true},{"expected":["ACCEPT","ACCEPT_WITH_WARNINGS"],"gate_id":"M12C-COMPONENT-TRUST","metric":"component_evidence_trust_action","observed":"ACCEPT_WITH_WARNINGS","pass":true},{"expected":[],"gate_id":"M12C-ASSET-BINDING","metric":"asset_identity_conflicts","observed":[],"pass":true},{"expected":[],"gate_id":"M12C-COMPONENT-BINDING","metric":"component_identity_conflicts","observed":[],"pass":true},{"expected":">=1","gate_id":"M12C-EXACT-TARGET-PACKAGE","metric":"exact_target_package_record_count","observed":1,"pass":true},{"expected":0,"gate_id":"M12C-BLOCKING-CONFLICTS","metric":"blocking_conflict_count","observed":0,"pass":true},{"expected":true,"gate_id":"M12C-TECHNICAL-ENGINE","metric":"technical_affectedness_engine_executed","observed":true,"pass":true},{"expected":true,"gate_id":"M12C-NEGATIVE-CLOSURE","metric":"negative_affectedness_closure_safe","observed":true,"pass":true},{"expected":false,"gate_id":"M12C-RUNTIME-SEMANTICS","metric":"reachability_or_mitigation_overrode_package_affectedness","observed":false,"pass":true},{"expected":"BLOCKED","gate_id":"M12C-PRODUCTION-BLOCK","metric":"production_readiness","observed":"BLOCKED","pass":true}],"release_decision":{"blocking_reasons":["Real operational validation has not yet been completed.","Independent security review has not yet been completed.","Human approval and remediation verification remain required before production closure.","Accountable human review is required for this adjudication."],"policy_eligibility":"ELIGIBLE","production_readiness":"BLOCKED","stage_gate":"PASS"},"report_id":"AEG-AFA-9E7D8F8A03A6A1EC07A6CC0A","runtime_context":{"affectedness_semantics":"Runtime reachability and mitigation influence exploitability and remediation handling, but do not rewrite whether the observed software version falls in an affected range.","configuration":"UNKNOWN","presence":"PRESENT","reachability":"UNKNOWN"},"schema_version":"1.0.0","target":{"asset_id":"AEG-AST-HOSP-SCHED-001","component":{"component_id":"AEG-CMP-LOG4J-CORE-001","ecosystem":"Maven","package_name":"org.apache.logging.log4j:log4j-core","purl":"pkg:maven/org.apache.logging.log4j/log4j-core@2.14.1","version":"2.14.1"},"cve_id":"CVE-2021-44228"},"technical_assessment":{"assessment_id":"AEG-AFF-AEG-CMP-LOG4J-CORE-001-CVE-2021-44228","component_version":"2.14.1","confidence":0.9794,"determination_method":"version_range","determined_at":"2026-07-21T20:18:26.665570+00:00","engine_version":"0.1.0","human_review_required":false,"package_match":{"component_name":"org.apache.logging.log4j:log4j-core","component_purl":"pkg:maven/org.apache.logging.log4j/log4j-core@2.14.1","confidence":1.0,"ecosystem":"Maven","intelligence_package_name":"org.apache.logging.log4j:log4j-core","intelligence_purl":"pkg:maven/org.apache.logging.log4j/log4j-core","matched":true,"method":"exact_purl","package_index":0,"reason_codes":["EXACT_PURL_MATCH"]},"policy":{"policy_id":"AEGIS-AFFECTEDNESS-POLICY","sha256":"84aa03a09bbc05a1b6e51a4e71a6aa0fefc9775f17866659e1ec4760ed9667f8","version":"1.0.0"},"range_evaluations":[{"affected":true,"before_introduced":false,"error":null,"fixed":"2.15.0","fixed_boundary_reached":false,"introduced":"2.13.0","last_affected":null,"range_index":0,"range_type":"ECOSYSTEM","reason_codes":["VERSION_WITHIN_AFFECTED_RANGE"],"valid":true},{"affected":false,"before_introduced":false,"error":null,"fixed":"2.3.1","fixed_boundary_reached":true,"introduced":"2.0-beta9","last_affected":null,"range_index":1,"range_type":"ECOSYSTEM","reason_codes":["FIXED_BOUNDARY_REACHED"],"valid":true},{"affected":false,"before_introduced":false,"error":null,"fixed":"2.12.2","fixed_boundary_reached":true,"introduced":"2.4","last_affected":null,"range_index":2,"range_type":"ECOSYSTEM","reason_codes":["FIXED_BOUNDARY_REACHED"],"valid":true}],"range_status":"available","reason_codes":["PACKAGE_IDENTITY_MATCHED","COMPONENT_VERSION_IN_AFFECTED_RANGE","AFFECTEDNESS_CONFIRMED"],"status":"affected","supporting_evidence_ids":["AEG-EVD-SBOM-LOG4J-001","AEG-OFFICIAL-B13909218EDC20AA374F"],"uncertainty_factors":[]},"trust":{"canonical_intelligence":{"action":"ACCEPT","aggregate_score":1.0,"blocking_conflicts":[],"blocking_freshness_findings":[],"failed_quality_gates":[],"reason_codes":["CANONICAL_INTELLIGENCE_ACCEPTED"],"warnings":[]},"combined":{"action":"ACCEPT_WITH_WARNINGS","aggregate_score":0.9794,"reason_codes":["COMPONENT_EVIDENCE_ACCEPT_WITH_WARNINGS","CANONICAL_INTELLIGENCE_ACCEPTED"]},"component_evidence":{"accepted":true,"action":"ACCEPT_WITH_WARNINGS","aggregate_score":0.9794,"assessed_at":"2026-07-21T20:18:26.665570+00:00","assessment_id":"AEG-TRUST-SBOM-LOG4J-001","dimensions":{"authenticity":{"below_floor":false,"evidence_paths":["authorization.status","authorization.collection_basis","authorization.approved_use","source.source_category"],"minimum_score":0.5,"name":"authenticity","reason_codes":["AUTHORIZATION_AUTHORIZED","COLLECTION_BASIS_APPROVED_TEST_FIXTURE","SOURCE_CATEGORY_AUTHORIZED_INTERNAL"],"score":0.9375,"status":"estimated","weight":0.16},"completeness":{"below_floor":false,"evidence_paths":["component_summary.component_count","component_summary.components_with_versions","component_summary.components_with_purl"],"minimum_score":0.5,"name":"completeness","reason_codes":["PURL_EXPECTED_FOR_EVIDENCE_TYPE","COMPONENT_VERSION_COVERAGE_EVALUATED","COMPONENT_PURL_COVERAGE_EVALUATED"],"score":1.0,"status":"estimated","weight":0.12},"consistency":{"below_floor":false,"evidence_paths":["conflicts"],"minimum_score":0.5,"name":"consistency","reason_codes":["NO_CONFLICTS_DETECTED"],"score":1.0,"status":"confirmed","weight":0.14},"freshness":{"below_floor":false,"evidence_paths":["freshness.status","freshness.age_seconds","freshness.maximum_age_seconds","freshness.evaluated_at"],"minimum_score":0.5,"name":"freshness","reason_codes":["FRESHNESS_CURRENT","AGE_WITHIN_HALF_FRESHNESS_WINDOW"],"score":1.0,"status":"confirmed","weight":0.12},"identity_confidence":{"below_floor":false,"evidence_paths":["component_summary.component_count","component_summary.components_with_versions","component_summary.components_with_purl"],"minimum_score":0.55,"name":"identity_confidence","reason_codes":["VERSION_IDENTITY_COVERAGE_EVALUATED","PURL_IDENTITY_COVERAGE_EVALUATED"],"score":1.0,"status":"estimated","weight":0.08},"integrity":{"below_floor":false,"evidence_paths":["integrity.status","integrity.hash_algorithm","integrity.content_hash","integrity.signature_status"],"minimum_score":0.6,"name":"integrity","reason_codes":["INTEGRITY_VERIFIED","CRYPTOGRAPHIC_HASH_PRESENT","SIGNATURE_NOT_VERIFIED"],"score":1.0,"status":"confirmed","weight":0.18},"parser_confidence":{"below_floor":false,"evidence_paths":["parser.parse_status","parser.parser_confidence","parser.warnings"],"minimum_score":0.6,"name":"parser_confidence","reason_codes":["PARSER_STATUS_SUCCESS"],"score":1.0,"status":"confirmed","weight":0.1},"source_authority":{"below_floor":false,"evidence_paths":["source.source_authority"],"minimum_score":0.45,"name":"source_authority","reason_codes":["SOURCE_AUTHORITY_HIGH"],"score":0.9,"status":"confirmed","weight":0.1}},"evidence_id":"AEG-EVD-SBOM-LOG4J-001","gate_results":[],"policy":{"aggregation_method":"weighted_geometric_mean","policy_id":"AEGIS-EVIDENCE-TRUST-POLICY","sha256":"6a4b41df0d5084bd